{
  "capabilities": [
    {
      "auth_modes": [
        "bearer",
        "session"
      ],
      "auth_roles": [
        "oauth-authorization-server",
        "oauth-resource-server",
        "openid-provider"
      ],
      "compiled": true,
      "id": "auth-oauth-server",
      "minimum_sdk_version": "0.1.0",
      "runtime_available": true
    },
    {
      "auth_modes": [],
      "auth_roles": [],
      "compiled": false,
      "id": "web-auth",
      "minimum_sdk_version": "0.1.0",
      "runtime_available": false
    }
  ],
  "contract_hash": "sha256:5216c9bfd20f9846d65db0c00df3ae545b6a82d708db12177134821f633e7469",
  "profile": "oauth-provider",
  "schema_version": "1.0.0",
  "service_version": "0.3.0",
  "transports": {
    "api": "/api"
  }
}
