{
  "schema_version": "1.0.0",
  "service_version": "1.1.0",
  "profile": "compatibility-fixture",
  "contract_hash": "sha256:bbbbbbbbbbbbbbbbbbbbbbbbbbbbbbbbbbbbbbbbbbbbbbbbbbbbbbbbbbbbbbbb",
  "capabilities": [
    {
      "id": "web-api",
      "compiled": true,
      "runtime_available": true,
      "minimum_sdk_version": "1.0.0",
      "auth_modes": [
        "bearer",
        "session"
      ]
    },
    {
      "id": "web-realtime",
      "compiled": true,
      "runtime_available": true,
      "minimum_sdk_version": "1.0.0",
      "auth_modes": [
        "session"
      ]
    },
    {
      "id": "web-search",
      "compiled": true,
      "runtime_available": true,
      "minimum_sdk_version": "1.0.0",
      "auth_modes": [
        "session"
      ]
    }
  ],
  "transports": {
    "api": "/api",
    "websocket": "/ws",
    "sse": "/events/widgets"
  }
}
