{
  "capabilities": [
    {
      "auth_modes": [
        "session"
      ],
      "compiled": true,
      "id": "web-auth",
      "minimum_sdk_version": "0.1.0",
      "runtime_available": true
    }
  ],
  "contract_hash": "sha256:c131b3406275f5f4958ca2a7952ba8871036d3225cc2eaf762b8d4037d5883ba",
  "profile": "web",
  "schema_version": "1.0.0",
  "service_version": "0.1.0",
  "transports": {
    "api": "/api"
  }
}
